day,month,title,content,reflection
7,1,"Два вуха, один рот: Мудрість слухання","Засновник стоїцизму Зенон із Кітіона любив повторювати: «Природа дала нам два вуха і лише один рот саме для того, щоб ми слухали вдвічі більше, ніж говорили». У сучасному світі ми часто використовуємо розмову лише для того, щоб нав'язати свою думку або потішити власне его. Але стоїк знає, що мудрість входить через вуха, а не через вуста. Вміння мовчати, коли хочеться сперечатися, і щиро слухати співрозмовника — це найвищий прояв самоконтролю. Слухання дозволяє тобі зрозуміти логіку іншої людини, побачити її помилки (і свої власні) та зберегти внутрішній спокій. Пам'ятай: шумний розум рідко буває мудрим. Справжня сила проявляється у здатності сприймати світ, а не намагатися перекричати його.","Протягом сьогоднішнього дня в кожній розмові давай співрозмовнику договорити до кінця, не перебиваючи навіть у думках. Спробуй зрозуміти не лише слова, а й причину, чому людина їх каже."
8,1,"Найкраща помста: Не стати ворогом","Марк Аврелій залишив одну з найпотужніших стоїчних порад: «Найкращий спосіб мститися — не ставати схожим на того, хто завдав тобі кривди». Коли нас ображають, перша реакція — відповісти тим самим: гнівом на гнів, підлістю на підлість. Але в цей момент ти стаєш дзеркальним відображенням свого ворога. Ти дозволяєш його порокам диктувати твої вчинки. Справжня перемога стоїка полягає в тому, щоб зберегти свою чесноту недоторканою, навіть якщо світ навколо поводиться несправедливо. Твоя незворушність і відмова спускатися на рівень кривдника — це і є найвища форма помсти. Ти залишаєшся господарем свого розуму, тоді як твій ворог залишається рабом своїх пристрастей.","Згадай людину, яка тебе дратує або колись образила. Пообіцяй собі сьогодні діяти максимально благородно та спокійно, особливо якщо доведеться з нею контактувати."
9,1,"Проайрезіс: Твоя остання свобода","Епіктет ввів поняття «Проайрезіс» — це наша здатність до морального вибору, яка є єдиною річчю, що повністю нам належить. Навіть якщо тебе кинуть у в'язницю, навіть якщо заберуть усе майно, твій «Проайрезіс» залишається вільним. Це внутрішній перемикач, який вирішує, як ти сприймаєш подію. Ти не обираєш, що з тобою станеться, але ти одноосібно обираєш, як до цього поставитися. Це ядро твоєї особистості, твоя «Внутрішня Фортеця». Коли ти усвідомлюєш це, ти припиняєш скаржитися на обставини. Жодна зовнішня сила не може змусити тебе зробити те, що суперечить твоїм принципам, якщо ти сам не здаси свою позицію. Ти — єдиний цензор своїх думок і єдиний автор своєї реакції.","Коли сьогодні виникне ситуація вибору (навіть дрібна), зупинись на мить і усвідом: «Зараз я користуюся своїм Проайрезісом». Обери варіант, за який тобі не буде соромно перед самим собою."
10,1,"Тренування духу: Практика дискомфорту","Сенека радив іноді виділяти кілька днів, щоб жити в найскромніших умовах: носити простий одяг і їсти найдешевшу їжу, запитуючи себе: «Чи цього я так боявся?». Це практика «добровільного дискомфорту». Коли ми занадто звикаємо до зручностей, ми стаємо їхніми рабами. Будь-яка загроза нашому комфорту викликає паніку. Але якщо ти навмисно тренуєшся обходитися малим, ти стаєш невразливим до поворотів долі. Це не мазохізм, а щеплення проти страху бідності чи втрат. Стоїк — це людина, яка може насолоджуватися бенкетом, але так само спокійно може вечеряти лише хлібом і водою. Справжнє багатство — це не кількість речей, а відсутність потреби в них для щастя.","Сьогодні відмовся від одного звичного комфорту: холодна кава замість гарячої, відмова від десерту або піша прогулянка замість авто. Відчуй, що твоя радість не залежить від цієї дрібниці."
11,1,"Соціальний борг: Бути частиною цілого","Марк Аврелій часто нагадував собі: «Ми народжені для спільної праці, як руки, як ноги, як повіки». У стоїцизмі немає місця для байдужості. Кожна твоя дія має бути спрямована на користь людської спільноти. Якщо ти робиш щось, що шкодить іншим, ти шкодиш самому собі, бо руйнуєш цілісність всесвіту. Справедливість — це не просто відсутність зла, це активне прагнення до добра. Стоїк не питає «Що я отримаю натомість?», він діє так само природно, як виноградна лоза дає плоди. Твоя роль у світі — бути опорою для тих, хто поруч, і діяти чесно, навіть якщо це ніхто не оцінить. Це і є життя згідно з природою — бути людиною серед людей.","Знайди сьогодні можливість допомогти комусь у роботі чи побуті. Зроби це без зайвих слів і не чекаючи подяки, сприймаючи це як виконання свого природного обов'язку."
12,1,"Мистецтво реагувати на критику","Коли Епіктету сказали, що хтось говорить про нього погано, він відповів: «Мабуть, цей чоловік не знав про інші мої вади, інакше б він не обмежувався лише цими». Це ідеальний приклад стоїчної реакції на критику. Замість того, щоб захищатися або гніватися, стоїк аналізує: якщо критика справедлива — це привід для вдосконалення; якщо ні — це свідчення помилки того, хто критикує. Твоя репутація — це зовнішня річ, вона в руках інших людей. Твоя ж справа — просто жити так, щоб будь-яка брехня про тебе виглядала безглуздо. Не витрачай час на виправдання перед тими, хто не хоче тебе розуміти. Твоя найкраща відповідь — твій спокій та твоє гідне життя.","Якщо сьогодні тебе хтось критикуватиме, спробуй не виправдовуватися. Просто вислухай, подякуй за думку і внутрішньо оціни, чи є в цих словах корисне зерно для твоєї роботи над собою."