day,month,title,content,reflection
21,12,Дихотомія контролю: Фундамент свободи,"Головне завдання у житті — просто розділити речі на дві категорії: зовнішні, які ми не можемо контролювати, та рішення, які ми приймаємо щодо них. Епіктет вчив: «Одні речі залежать від нас, а інші — ні». До того, що залежить, належать наші думки, прагнення та власні дії. Все інше — тіло, майно, репутація — поза нашою владою. Велика помилка людини — витрачати психічну енергію на те, що вона не може змінити. Коли ти хвилюєшся через затори чи думку сусіда — ти стаєш рабом. Коли ти фокусуюсь на своїй реакції — ти стаєш вільним.","Випиши сьогодні одну річ, яка тебе дратує, але на яку ти не можеш вплинути. Скажи собі: «Це не в моїй владі» — і відпусти її."
22,12,Amor Fati: Любов до своєї долі,"Стоїки не просто терпіли те, що з ними відбувається — вони це любили. Amor Fati (любов до долі) — це не пасивна покора, а активне прийняття реальності. Фрідріх Ніцше описував це як формулу людської величі: не хотіти, щоб щось було інакшим ні в майбутньому, ні в минулому, ні в цілій вічності. Коли стається щось «погане», сприймай це не як перешкоду, а як паливо. Якщо життя підкинуло тобі лимон — це не привід скаржитись, це можливість випробувати свою стійкість та винахідливість. Все, що відбувається, працює на твій розвиток, якщо ти сам так вирішиш.","Згадай складну ситуацію, яка сталася нещодавно. Знайди в ній один позитивний наслідок або урок, який вона тобі дала. Подякуй долі за цей досвід."
23,12,Погляд зверху: Твій масштаб,"Марк Аврелій часто практикував вправу «Погляд зверху». Уяви, що ти піднімаєшся над своїм містом, країною, а потім і всією планетою. З цієї висоти твої щоденні тривоги, образи та суперечки стають майже непомітними піщинками. Це не знецінення твого життя, а відновлення здорової перспективи. Більшість речей, які здаються нам «катастрофами» сьогодні, не матимуть жодного значення через рік. Пам'ятай про масштаб всесвіту, щоб зберігати спокій у дрібницях.","Коли сьогодні відчуєш стрес, уяви себе точкою на мапі світу. Чи справді ця подія варта твоєї внутрішньої гармонії в масштабі життя?"
24,12,Перешкода — це шлях,"Стоїки вірили, що кожна перешкода на твоєму шляху є можливістю для тренування чесноти. Якщо хтось тебе образив — це можливість проявити терпіння. Якщо плани зруйнувалися — це шанс на винахідливість. Марк Аврелій писав: «Те, що стоїть на заваді дії, сприяє дії. Те, що стоїть на шляху, стає шляхом». Не чекай ідеальних умов. Використовуй саму проблему як інструмент для росту.","Яка головна перешкода стоїть перед тобою зараз? Яку саме якість (мужність, дисципліну чи спокій) вона допомагає тобі натренувати?"
25,12,Внутрішня фортеця: Твій незламний центр,"Марк Аврелій часто згадував про концепцію «Внутрішньої фортеці» — місця всередині твого розуму, куди не може проникнути жодна зовнішня подія, якщо ти сам цього не дозволиш. Світ може бути хаотичним, люди можуть бути несправедливими, а обставини — важкими. Але твій розум залишається вільним. Це як шторм у морі: на поверхні вирують величезні хвилі, але на великій глибині панує абсолютний спокій. Твоя фортеця будується з твоїх принципів та твоєї здатності не давати оцінку подіям як «жахливим». Що б не сталось зовні, ти завжди можеш відступити у цю внутрішню тишу, щоб відновити сили та прийняти зважене рішення. Ніхто не може забрати у тебе право на твою внутрішню реакцію.","Що сьогодні намагалося «штурмувати» твою внутрішню фортецю? Чи вдалося цим подіям прорватися всередину, чи ти зміг зберегти спокій, спостерігаючи за ними зі сторони?"
26,12,Твоя єдина власність — цей момент,"Сенека у своїх листах наголошував, що ми часто поводимося з часом так, ніби він безкінечний. Ми відкладаємо життя на «потім», сподіваючись на щасливе майбутнє, або зациклюємося на минулому, яке вже неможливо змінити. Але стоїк знає: минуле нам уже не належить, а майбутнє — ще не настало. Все, що в нас є насправді — це вузька смужка теперішнього моменту. Саме зараз ти обираєш, ким бути. Саме зараз ти формуєш свій характер. Не чекай «ідеального часу», щоб почати практикувати мудрість чи бути доброю людиною. Життя не складається з великих досягнень, воно складається з тисяч маленьких «зараз». Використовуй цей момент гідно, бо це єдине, чим ти насправді володієш у цьому світі.","Скільки часу сьогодні твій розум провів у минулому (жалі) чи в майбутньому (тривозі)? Спробуй прямо зараз на одну хвилину повністю зосередитися на тому, що ти робиш, бачиш і відчуваєш у цей конкретний момент."
27,12,Memento Mori: Твій найсильніший стимул,"Memento Mori — це не похмуре нагадування про кінець, а найпотужніший інструмент для повноцінного життя. Сенека казав, що ми поводимося так, ніби будемо жити вічно, марнуючи час на дріб'язкові суперечки та безглузді справи. Усвідомлення того, що твій час обмежений, не повинно вводити в депресію. Навпаки, воно має стати фільтром, який відсікає все зайве. Коли ти пам'ятаєш, що кожен твій вдих може бути останнім, ти перестаєш ображатися на дурнів, перестаєш боятися ризикувати і починаєш цінувати людей навколо. Смерть робить життя цінним. Не відкладай доброту, щирість та сміливість на наступний рік — у тебе є лише цей момент.","Якби ти точно знав, що цей день — останній у році, на що б ти витратив залишок вечора? Чи змінилося б твоє ставлення до сьогоднішніх проблем?"
28,12,Дисципліна — це свобода,"Дисципліна часто сприймається як обмеження, але для стоїка це єдиний шлях до справжньої свободи. Людина, яка не може контролювати свої імпульси, бажання та емоції — не є вільною, вона є рабом своєї біології та обставин. Епіктет вчив, що справжній господар — це той, хто володіє собою. Кожного разу, коли ти обираєш дисципліну замість миттєвого задоволення, ти будуєш свій характер. Це стосується всього: від режиму дня до контролю гніву. Бути дисциплінованим — означає жити згідно зі своїми цінностями, а не згідно зі своїм настроєм. Саме це створює внутрішній спокій, який неможливо похитнути зовнішнім хаосом.","У якій сфері твого життя сьогодні «керує» настрій, а не розум? Зроби один маленький крок, щоб повернути контроль собі."
29,12,Спільне благо: Твоя роль у світі,"Ми часто думаємо про стоїцизм як про індивідуальну практику, але Марк Аврелій постійно нагадував про концепцію «Sympatheia» — взаємозв'язку всього у всесвіті. Ми — як частини одного організму. Те, що корисно для вулика, корисно і для бджоли. Твої вчинки впливають на світ навколо тебе більше, ніж ти думаєш. Стоїк не ізолюється від світу; він діє заради спільного блага, проявляючи справедливість та доброту навіть тоді, коли ніхто не бачить. Твоя мужність і чесність надихають інших. Твій спокій допомагає заспокоїтися близьким. Ми стаємо кращими не просто для себе, а для того, щоб бути корисними іншим.","Яку добру справу (навіть найменшу) ти можеш зробити сьогодні для іншої людини, не чекаючи нічого натомість?"
30,12,Справедливість: Твій обов’язок перед світом,"Стоїцизм часто помилково вважають вченням про індивідуальну ізоляцію, але Марк Аврелій нагадував: «Ми народжені для спільної праці, як ноги, руки, повіки». Справедливість для стоїка — це не просто дотримання законів, це активна доброта та чесність. Це розуміння того, що будь-яка твоя дія (або бездіяльність) впливає на загальний стан «вулика». Якщо ти бачиш несправедливість і мовчиш — ти береш у ній участь. Якщо ти можеш допомогти і не допомагаєш — ти руйнуєш зв'язок між людьми. Бути стоїком означає бути корисним частиною цілого. Твій спокій не має бути байдужістю; він має бути фундаментом, на якому ти будуєш справедливе та добре ставлення до кожної людини, яку зустрічаєш. Справжня мудрість проявляється в тому, як ти поводишся з тими, хто нічим не може бути тобі корисним.","Зроби сьогодні одну корисну справу, про яку ніхто ніколи не дізнається. Переконайся, що твій мотив — щире бажання допомогти, а не прагнення похвали."
31,12,Останній день року: Чистий аркуш,"Останній день року — це не просто зміна цифри в календарі, це момент для глибокої рефлексії. Ти пройшов через виклики, здобув перемоги і, можливо, робив помилки. Стоїк не витрачає час на жаль за минулим, він використовує його як матеріал для навчання. Сенека радив щовечора ставити собі питання: «Яку погану звичку я подолав? У чому я став кращим?». Сьогодні підсумуй не свої досягнення, а свій прогрес у характері. Завтра почнеться новий цикл, але тобі не потрібно чекати ранку, щоб стати іншою людиною. Кожна мить — це можливість почати спочатку. Твоя філософія — це не те, що ти читаєш, а те, як ти живеш прямо зараз.","Який головний урок приніс тобі цей рік? Запиши одну рису характеру, яку ти обіцяєш собі плекати у наступному році."
1,1,"Новий початок: Мистецтво оновлення розуму","Для стоїка новий рік — це не просто зміна цифри в календарі, а привід для глибокого внутрішнього аудиту. Марк Аврелій писав: «Ти можеш почати нове життя прямо зараз. Подивись на речі по-новому, як ти це робив раніше — у цьому і полягає оновлення». Ми часто тягнемо за собою вантаж минулих помилок, образ та невдач, ніби вони визначають наше майбутнє. Але стоїчна мудрість каже, що кожен момент — це «чистий аркуш». Твій характер будується не вчора, а саме зараз, через рішення, які ти приймаєш у цю секунду. Не чекай особливої дати, щоб стати кращим; використовуй цей день як фундамент для своєї «Внутрішньої Фортеці». Життя починається знову щоразу, коли ти робиш вибір на користь розуму та чесноти.","Запиши одну стару звичку або думку, яка найбільше заважала тобі минулого року. Уяви, як ти залишаєш її за порогом, і пообіцяй собі сьогодні діяти так, ніби ти — нова, мудріша версія себе."
2,1,"Корінь свободи: Твоя єдина влада","Перший крок до мудрості, згідно з Епіктетом, полягає в усвідомленні межі між твоїм внутрішнім світом та зовнішнім хаосом. Все, що відбувається зовні — економіка, погода, вчинки інших людей — не належить тобі. Спроба контролювати ці речі — це шлях до рабства та вічного неспокою. Твоя єдина і справжня власність — це твої судження, твої прагнення та твоя здатність обирати реакцію на події. Якщо ти спрямуєш усю свою енергію на те, що залежить від тебе, ніхто і ніщо у всесвіті не зможе тобі зашкодити або зупинити тебе. Свобода починається там, де ти припиняєш вимагати від світу відповідності твоїм очікуванням і починаєш вимагати від себе відповідності твоїм принципам.","Сьогодні, коли ти відчуєш найменше роздратування через зовнішню подію (черга, новини, затори), зупинись і скажи собі: «Це подія зовнішня, вона поза моєю владою. Моя влада — у тому, як я на це дивлюся»."
3,1,"Ранкова підготовка: Зустріч із недосконалим світом","Марк Аврелій починав свій день із чесної розмови з собою: «Сьогодні я зустріну людей настирливих, невдячних, зухвалих і підступних». Це не песимізм, а «premeditatio malorum» — попередня підготовка до викликів. Коли ми очікуємо, що світ буде ідеальним, кожна дрібниця вибиває нас із колії. Коли ж ми знаємо, що люди можуть помилятися через своє незнання добра, ми стаємо невразливими для їхньої агресії. Стоїк не дивується хаосу, він готовий зустріти його спокійно, як скеля зустрічає хвилі. Пам’ятай: ніхто не може змусити тебе відчувати гнів, якщо ти сам не погодишся на цю емоцію. Твій спокій — це твоя відповідальність перед самим собою.","Перед виходом з дому або початком роботи уяви одну неприємну ситуацію, яка може статися сьогодні. Пообіцяй собі зустріти її з усмішкою або повним спокоєм, пам'ятаючи, що це лише черговий іспит для твого розуму."
4,1,"Внутрішня цитадель: Твій притулок у хаосі","Ми часто шукаємо спокою в подорожах, відпустках або самотності, сподіваючись, що зовнішня тиша заспокоїть внутрішній шторм. Але Марк Аврелій нагадував: «Людина не може знайти місця спокійнішого і безтурботнішого, ніж власна душа». Твій розум — це твоя персональна цитадель. Якщо ти навчишся відступати в неї, ти знайдеш мир навіть посеред найгучнішої битви. Ця фортеця будується не з каменю, а з твоїх переконань. Вона стає незламною, коли ти розумієш, що зовнішні речі не мають доступу до твоєї сутності, поки ти сам не відкриєш їм двері. Відновити сили можна будь-де і будь-коли — достатньо просто звернутися до свого внутрішнього центру мудрості.","Протягом дня, коли навколо стане занадто гамірно або стресово, зроби три глибокі вдихи і уяви, що ти заходиш у тиху, захищену кімнату всередині свого розуму. Відчуй, що там ти в повній безпеці від будь-яких слів чи подій."
5,1,"Об'єктивне сприйняття: Речі як вони є","Велика частина нашого страждання походить не від самих подій, а від «етикеток», які ми на них наклеюємо. Ми кажемо: «Це жахливо», «Це несправедливо», «Я цього не витримаю». Стоїцизм вчить нас практикувати об'єктивне сприйняття. Спробуй зняти емоційні прикметники з реальності. Втрата грошей — це просто зміна цифр на рахунку. Критика — це просто звукові хвилі, що виходять з чиїхось вуст. Невдача — це просто результат, який відрізняється від очікуваного. Коли ти бачиш речі голими, без прикрас і драматизації, вони втрачають свою владу над твоїм серцем. Дивись на світ очима науковця, а не жертви. Об'єктивність — це найкоротший шлях до незворушності.","Обери ситуацію, яка тебе зараз турбує. Опиши її максимально сухо і фактично, без слів «погано», «важко» чи «страшно». Подивись, наскільки меншою стала ця проблема, коли ти прибрав з неї свої оціночні судження."
6,1,"Кола причетності: Від себе до людства","Давньогрецький стоїк Гієрокл пропонував уявити наше життя як серію концентричних кіл. У центрі — твій розум, далі — твоє тіло, потім — сім'я, друзі, сусіди, і, нарешті, все людство. Його ідея полягала в тому, щоб поступово «притягувати» ці кола до центру, ставлячись до чужинців так само турботливо, як до родичів. Стоїцизм — це не егоїстична ізоляція, а глибоке розуміння того, що ми всі пов'язані спільним розумом. Коли ти допомагаєш іншому, ти допомагаєш частині того самого цілого, до якого належиш і сам. Справжня мудрість проявляється в тому, наскільки широким є коло людей, яких ти вважаєш «своїми». Твій обов'язок — бути корисним вузлом у цій всесвітній мережі.","Сьогодні, спілкуючись із незнайомцем (продавцем, водієм, колегою), спробуй подумки назвати його «братом» або «сестрою». Подивись, як це змінить твоє ставлення та тон розмови."
